{
  "schema_version": "1.1",
  "id": "concept-orchestration-boundary",
  "type": "concept",
  "label": "orchestration-boundary",
  "description": "Concept connected through IOAYN learning assets: orchestration-boundary",
  "ref_type": "concept",
  "ref_id": "concept-orchestration-boundary",
  "status": {
    "model": "modeled",
    "connection": "connected",
    "freshness": "current",
    "unknowns": "clear"
  },
  "tags": [
    "concept"
  ],
  "evidence_refs": [],
  "unknown_refs": [],
  "revision": {
    "branch": "master",
    "commit": "a8d4d8f2fb0b7a509855b510d5c9af5599391794",
    "dirty": true
  },
  "created_at": "2026-07-21T11:09:42.719Z",
  "updated_at": "2026-07-21T11:09:42.719Z"
}
