{
  "schema_version": "1.1",
  "id": "atlas-asset-live-probe-main",
  "type": "learning_asset",
  "label": "存活探测主 I/O 路径",
  "description": "目标字符串如何变成存活结果？",
  "ref_type": "learning_asset",
  "ref_id": "asset-live-probe-main",
  "system_area": "engine/live-probe",
  "status": {
    "model": "verified",
    "connection": "connected",
    "freshness": "current",
    "unknowns": "clear"
  },
  "tags": [
    "learning-asset",
    "flow_understanding",
    "L2"
  ],
  "evidence_refs": [
    "round-live-probe-1-evidence-1"
  ],
  "unknown_refs": [
    "round-live-probe-1-unknown-1"
  ],
  "revision": {
    "branch": "master",
    "commit": "a8d4d8f2fb0b7a509855b510d5c9af5599391794",
    "dirty": true
  },
  "created_at": "2026-07-21T11:09:42.713Z",
  "updated_at": "2026-07-21T11:09:42.713Z"
}
